{
  "format": "ovs-ask-traces",
  "version": "0.1",
  "built": "2026-07-15",
  "source": [
    "app/data/nodes/ask-fixtures.json",
    "app/data/nodes/ask-core.json",
    "app/data/nodes/ask-index.json"
  ],
  "purpose": "Deterministic resolver traces for app-owned Ask integration and visual QA.",
  "resolverModel": "pipeline/build_nodes.js resolveAskQuery",
  "traces": [
    {
      "query": "is nestle bad",
      "normalized": "nestle",
      "intent": "company/brand concern",
      "layer": "core",
      "file": "ask-core.json",
      "expectAny": [
        "ovs:company/nestle",
        "ovs:line/avoid:nestle",
        "ovs:brand/nestle"
      ],
      "expectOneInTop": 5,
      "orderingAssertions": [],
      "matched": "ovs:brand/nestle",
      "matchedRank": 1,
      "orderingChecks": [],
      "ok": true,
      "top": [
        {
          "id": "ovs:brand/nestle",
          "label": "Nestlé",
          "type": "brand",
          "route": "node",
          "hash": "#n/brand/nestle",
          "score": 120,
          "reason": "alias",
          "key": "nestle"
        },
        {
          "id": "ovs:company/nestle",
          "label": "Nestlé",
          "type": "company",
          "route": "node",
          "hash": "#n/company/nestle",
          "score": 110,
          "reason": "exact",
          "key": "nestle"
        },
        {
          "id": "ovs:line/avoid:nestle",
          "label": "Avoid Nestlé",
          "type": "line",
          "route": "node",
          "hash": "#n/line/avoid%3Anestle",
          "score": 110,
          "reason": "exact",
          "key": "nestle"
        },
        {
          "id": "ovs:company/alphabet",
          "label": "Alphabet / Google",
          "type": "company",
          "route": "node",
          "hash": "#n/company/alphabet",
          "score": 76,
          "reason": "token-containment",
          "key": "nest"
        },
        {
          "id": "ovs:line/avoid:alphabet",
          "label": "Avoid Alphabet / Google",
          "type": "line",
          "route": "node",
          "hash": "#n/line/avoid%3Aalphabet",
          "score": 76,
          "reason": "token-containment",
          "key": "nest"
        }
      ]
    },
    {
      "query": "vegan cheese",
      "normalized": "vegan cheese",
      "intent": "multi-intent food query",
      "layer": "core",
      "file": "ask-core.json",
      "expectAny": [
        "ovs:cat/cheese",
        "ovs:tag/vegan"
      ],
      "expectOneInTop": 5,
      "orderingAssertions": [],
      "matched": "ovs:cat/cheese",
      "matchedRank": 3,
      "orderingChecks": [],
      "ok": true,
      "top": [
        {
          "id": "ovs:line/diet:vegan",
          "label": "Vegan",
          "type": "line",
          "route": "node",
          "hash": "#n/line/diet%3Avegan",
          "score": 95,
          "reason": "query-token",
          "key": "vegan"
        },
        {
          "id": "ovs:line/diet:vegetarian",
          "label": "Vegetarian",
          "type": "line",
          "route": "node",
          "hash": "#n/line/diet%3Avegetarian",
          "score": 95,
          "reason": "query-token",
          "key": "vegan"
        },
        {
          "id": "ovs:cat/cheese",
          "label": "Cheese",
          "type": "category",
          "route": "explore",
          "hash": "#explore/cheese",
          "score": 95,
          "reason": "query-token",
          "key": "cheese"
        },
        {
          "id": "ovs:tag/vegan",
          "label": "Vegan",
          "type": "tag",
          "route": "node",
          "hash": "#n/tag/vegan",
          "score": 95,
          "reason": "query-token",
          "key": "vegan"
        },
        {
          "id": "ovs:guide/cheese",
          "label": "Cheese: use, sodium, and dairy impact",
          "type": "guide",
          "route": "guide",
          "hash": "#guide/cheese",
          "score": 95,
          "reason": "query-token",
          "key": "cheese"
        }
      ]
    },
    {
      "query": "best bank",
      "normalized": "bank",
      "intent": "plain category question",
      "layer": "core",
      "file": "ask-core.json",
      "expectAny": [
        "ovs:cat/banking",
        "ovs:errand/pick-a-bank"
      ],
      "expectOneInTop": 5,
      "orderingAssertions": [],
      "matched": "ovs:cat/banking",
      "matchedRank": 1,
      "orderingChecks": [],
      "ok": true,
      "top": [
        {
          "id": "ovs:cat/banking",
          "label": "Banking",
          "type": "category",
          "route": "explore",
          "hash": "#explore/banking",
          "score": 120,
          "reason": "alias",
          "key": "bank"
        },
        {
          "id": "ovs:guide/ethical-banking",
          "label": "Banking: fees, access, and fossil financing",
          "type": "guide",
          "route": "guide",
          "hash": "#guide/ethical-banking",
          "score": 76,
          "reason": "token-containment",
          "key": "banking"
        },
        {
          "id": "ovs:errand/pick-a-bank",
          "label": "Pick a bank",
          "type": "errand",
          "route": "node",
          "hash": "#n/errand/pick-a-bank",
          "score": 75,
          "reason": "token-containment",
          "key": "bank account"
        },
        {
          "id": "ovs:company/jpmorgan-chase",
          "label": "JPMorgan Chase",
          "type": "company",
          "route": "node",
          "hash": "#n/company/jpmorgan-chase",
          "score": 72,
          "reason": "token-containment",
          "key": "j p morgan private bank"
        }
      ]
    },
    {
      "query": "coke",
      "normalized": "coke",
      "intent": "everyday brand alias",
      "layer": "core",
      "file": "ask-core.json",
      "expectAny": [
        "ovs:company/coca-cola",
        "ovs:line/avoid:coca-cola",
        "ovs:brand/coca-cola"
      ],
      "expectOneInTop": 5,
      "orderingAssertions": [],
      "matched": "ovs:line/avoid:coca-cola",
      "matchedRank": 2,
      "orderingChecks": [],
      "ok": true,
      "top": [
        {
          "id": "ovs:brand/coke",
          "label": "Coke",
          "type": "brand",
          "route": "node",
          "hash": "#n/brand/coke",
          "score": 120,
          "reason": "alias",
          "key": "coke"
        },
        {
          "id": "ovs:line/avoid:coca-cola",
          "label": "Avoid Coca-Cola Company",
          "type": "line",
          "route": "node",
          "hash": "#n/line/avoid%3Acoca-cola",
          "score": 110,
          "reason": "exact",
          "key": "coke"
        },
        {
          "id": "ovs:brand/coles",
          "label": "coles",
          "type": "brand",
          "route": "node",
          "hash": "#n/brand/coles",
          "score": 86,
          "reason": "fuzzy-1",
          "key": "cole"
        },
        {
          "id": "ovs:company/coca-cola",
          "label": "Coca-Cola Company",
          "type": "company",
          "route": "node",
          "hash": "#n/company/coca-cola",
          "score": 75,
          "reason": "token-containment",
          "key": "coke zero"
        },
        {
          "id": "ovs:brand/coke-zero",
          "label": "Coke ZERO",
          "type": "brand",
          "route": "node",
          "hash": "#n/brand/coke-zero",
          "score": 75,
          "reason": "token-containment",
          "key": "coke zero"
        }
      ]
    },
    {
      "query": "nestel",
      "normalized": "nestel",
      "intent": "single-edit typo",
      "layer": "core",
      "file": "ask-core.json",
      "expectAny": [
        "ovs:company/nestle",
        "ovs:brand/nestle",
        "ovs:line/avoid:nestle"
      ],
      "expectOneInTop": 5,
      "orderingAssertions": [
        {
          "id": "typo-before-loose-containment",
          "winnerReason": "fuzzy-1",
          "winnerAny": [
            "ovs:company/nestle",
            "ovs:brand/nestle",
            "ovs:line/avoid:nestle"
          ],
          "loserReason": "token-containment",
          "note": "Single-edit typo results must rank before loose containment matches such as Nest."
        }
      ],
      "matched": "ovs:company/nestle",
      "matchedRank": 1,
      "orderingChecks": [
        {
          "id": "typo-before-loose-containment",
          "note": "Single-edit typo results must rank before loose containment matches such as Nest.",
          "winnerReason": "fuzzy-1",
          "loserReason": "token-containment",
          "winnerRank": 1,
          "loserRank": 4,
          "ok": true
        }
      ],
      "ok": true,
      "top": [
        {
          "id": "ovs:company/nestle",
          "label": "Nestlé",
          "type": "company",
          "route": "node",
          "hash": "#n/company/nestle",
          "score": 86,
          "reason": "fuzzy-1",
          "key": "nestle"
        },
        {
          "id": "ovs:line/avoid:nestle",
          "label": "Avoid Nestlé",
          "type": "line",
          "route": "node",
          "hash": "#n/line/avoid%3Anestle",
          "score": 86,
          "reason": "fuzzy-1",
          "key": "nestle"
        },
        {
          "id": "ovs:brand/nestle",
          "label": "Nestlé",
          "type": "brand",
          "route": "node",
          "hash": "#n/brand/nestle",
          "score": 86,
          "reason": "fuzzy-1",
          "key": "nestle"
        },
        {
          "id": "ovs:company/alphabet",
          "label": "Alphabet / Google",
          "type": "company",
          "route": "node",
          "hash": "#n/company/alphabet",
          "score": 76,
          "reason": "token-containment",
          "key": "nest"
        },
        {
          "id": "ovs:line/avoid:alphabet",
          "label": "Avoid Alphabet / Google",
          "type": "line",
          "route": "node",
          "hash": "#n/line/avoid%3Aalphabet",
          "score": 76,